{
  "CombatId": "cmyc_22",
  "Description": "A root-golem drives a mindless pack through the narrow passage.",
  "NpcIds": [
    "myc_golem",
    "myc_thrall",
    "myc_lurker",
    "myc_spitter"
  ],
  "CombatTier": "T4",
  "Background": "Spider_Lair",
  "NpcRemoveInMadness0Index": -1,
  "HealHeroes": false,
  "IsRift": false,
  "NpcToSummonOnKilledId": "",
  "EventDataId": "",
  "CombatEffects": [
    {
      "AuraCurse": "myc_symbiosis",
      "Charges": 1,
      "Target": "Monsters"
    }
  ]
}