{
  "CombatId": "cmyc_23",
  "Description": "Shambling warriors charge with reckless fury.",
  "NpcIds": [
    "myc_thrall",
    "myc_thrall",
    "myc_spitter"
  ],
  "CombatTier": "T3",
  "Background": "Senenthia_Deepforest",
  "NpcRemoveInMadness0Index": -1,
  "HealHeroes": false,
  "IsRift": false,
  "NpcToSummonOnKilledId": "",
  "EventDataId": "",
  "CombatEffects": []
}